{
  "identifier": "paper-launch-evidence:replace-with-reviewed-identifier",
  "observed_at": "2026-08-03T21:00:00+00:00",
  "knowledge_cutoff": "2026-08-03T21:00:00+00:00",
  "window_start": "2026-07-29T21:00:00+00:00",
  "window_end": "2026-08-03T21:00:00+00:00",
  "baseline_identifier": "test-baseline:replace-with-immutable-baseline",
  "process_version": "capital-intelligence-investment-process.v1",
  "code_version": "replace-with-tested-commit-sha",
  "portfolio_count": 1,
  "portfolio_code": "COMPOUNDING",
  "starting_capital": 250000.0,
  "base_currency": "USD",
  "paper_only_disclosures_verified": true,
  "live_broker_credentials_present": false,
  "canonical_portfolio_integrity_verified": true,
  "eligible_universe_integrity_verified": true,
  "execution_store_integrity_verified": true,
  "scheduled_cycles": 5,
  "successful_cycles": 5,
  "point_in_time_cycles": 5,
  "complete_universe_cycles": 5,
  "required_provider_checks": 500,
  "successful_required_provider_checks": 500,
  "shadow_execution_scenarios": 12,
  "reconciled_shadow_execution_scenarios": 12,
  "execution_cost_error_bps": 10.0,
  "unresolved_orders": 0,
  "duplicate_fill_events": 0,
  "negative_cash_events": 0,
  "stale_quote_acceptances": 0,
  "unresolved_critical_incidents": 0,
  "data_integrity_failures": 0,
  "reconciliation_failures": 0,
  "backup_restore_exercises": 1,
  "scheduler_replay_exercises": 1,
  "kill_switch_exercises": 2,
  "provider_failover_exercises": 1,
  "market_session_exercises": 3,
  "partial_fill_retry_exercises": 1,
  "corporate_action_replay_exercises": 1,
  "fx_revaluation_exercises": 1,
  "production_binding_approval_identifier": "replace-with-active-binding-approval",
  "recovery_certification_identifier": "replace-with-reviewed-recovery-report",
  "execution_calibration_identifier": "replace-with-execution-calibration",
  "execution_policy_version": "multi-asset-paper-execution.v1",
  "data_readiness_identifier": "replace-with-combined-data-readiness-report",
  "product_readiness_identifier": "replace-with-pre-launch-readiness-evidence",
  "evidence_identifiers": [
    "replace-with-cycle-burn-in-report",
    "replace-with-provider-health-report",
    "replace-with-execution-scenario-report"
  ],
  "source_identifiers": [
    "replace-with-canonical-portfolio-store-hash",
    "replace-with-eligible-universe-store-hash",
    "replace-with-execution-store-hash"
  ],
  "schema_version": "paper-trading-launch-evidence.v1"
}
